{
  "agent_repo": "gh-admin-overreach",
  "target_system": "github",
  "detected": true,
  "agent_count": 1,
  "action_patterns": ["read_repo", "push", "manage_webhook"],
  "risk_rank": 3,
  "policy_generated": true,
  "notes": "Infra syncer: direct push to default branches + webhook management + write-all CI. Highest blast radius in the corpus; scanner must detect one agent, surface push + manage_webhook, rank it above the PR bot, and emit a restrictive policy."
}
